{
  "id": "PV1-R1-009",
  "title": "Cross-board electrical interface is only a signal-class proposal",
  "severity": "blocking",
  "category": "digital_audio",
  "board": "interface",
  "phase": "R1",
  "component_interface": "Board A to Board B power/audio/control/safety interface",
  "description": "The product lists interface signal classes but not validated voltage/timing, pin count, fault polarity, return allocation or power-off behavior. A controlled interface freeze needs those details.",
  "evidence": [
    {
      "source": "docs/product/ANC_B2B_Custom_PCB_2_Kart_Mimari_Tasarim_Dokumani_v1.0.docx",
      "location": "§5.1; §6 return-current rule",
      "note": "Signal classes are proposed; exact pinout waits for schematic freeze."
    }
  ],
  "calculation_reference": [],
  "status": "open",
  "blocking": true,
  "discovered_at": "2026-09-26T10:41:41Z",
  "blocks_from_phase": "R3",
  "decision_id": null,
  "closure_criterion": "Produce a versioned interface contract with source/sink and logic levels, audio mastership/format/timing, I2C pullups, 5 V/return current, mute/fault/PGOOD default states, startup/shutdown and disconnected-board behavior; independently verify endpoints before R3 PASS. Keep connector mechanics separate.",
  "resolved_by": null,
  "resolution": null
}
