{
  "id": "PV1-R1-006",
  "title": "Board envelope and connector mechanics need manufacturer geometry",
  "severity": "blocking",
  "category": "mechanical",
  "board": "interface",
  "phase": "R1",
  "component_interface": "Board A/B stack and board-to-board connector",
  "description": "The product leaves board dimensions and connector series open until crib volume and cable routing are provided. Electrical interface classes can be controlled separately.",
  "evidence": [
    {
      "source": "docs/product/ANC_B2B_Custom_PCB_2_Kart_Mimari_Tasarim_Dokumani_v1.0.docx",
      "location": "§5.2; §12 item 5",
      "note": "Dimensions and connector depend on crib-manufacturer geometry and harness route."
    },
    {
      "source": "docs/product_v1/phase_r3_system_architecture.md",
      "location": "section 6 finding disposition",
      "note": "R3 reviewed this finding; its existing blocker phase and required external/R4 evidence remain open."
    },
    {
      "source": "docs/product_v1/phase_r4_schematic_readiness.md",
      "location": "section 7 connector boundary",
      "note": "R4 preflight reviewed this finding. External physical/acoustic/mechanical closure remains phase-scoped; R4 did not close it."
    }
  ],
  "calculation_reference": [],
  "status": "open",
  "blocking": true,
  "discovered_at": "2026-09-26T10:41:41Z",
  "blocks_from_phase": "R7",
  "decision_id": "D5",
  "closure_criterion": "Obtain controlled crib volume, mounting datum, allowable stack height, cable routes and assembly/service constraints; then select and verify keyed connector and board envelopes with contact/current/return budgets before R7 PASS.",
  "resolved_by": null,
  "resolution": null
}
