{
  "id": "PV1-R1-007",
  "title": "Microphone role and placement need acoustic geometry",
  "severity": "blocking",
  "category": "validation",
  "board": "board_a",
  "phase": "R1",
  "component_interface": "Four external microphone channels and role map",
  "description": "The PCB must retain four electrically equivalent channels, but reference/error/monitoring roles and placement depend on acoustic geometry and algorithm testing.",
  "evidence": [
    {
      "source": "docs/product/ANC_B2B_Custom_PCB_2_Kart_Mimari_Tasarim_Dokumani_v1.0.docx",
      "location": "§2.1; §12 item 6",
      "note": "Role and placement are explicitly deferred to acoustic geometry and tests."
    },
    {
      "source": "docs/product_v1/phase_r3_system_architecture.md",
      "location": "section 6 finding disposition",
      "note": "R3 reviewed this finding; its existing blocker phase and required external/R4 evidence remain open."
    },
    {
      "source": "docs/product_v1/phase_r4_schematic_readiness.md",
      "location": "section 7 microphone roles",
      "note": "R4 preflight reviewed this finding. External physical/acoustic/mechanical closure remains phase-scoped; R4 did not close it."
    }
  ],
  "calculation_reference": [],
  "status": "open",
  "blocking": true,
  "discovered_at": "2026-09-26T10:41:41Z",
  "blocks_from_phase": "R13",
  "decision_id": "D6",
  "closure_criterion": "Document actual crib microphone geometry, channel mapping and algorithm/acoustic evidence for reference/error/monitoring assignments; preserve four equivalent electrical inputs and approve final harness/placement map before R13 PASS.",
  "resolved_by": null,
  "resolution": null
}
