{
  "id": "PV1-R1-011",
  "title": "Hardware safe-mute response contract is incomplete",
  "severity": "blocking",
  "category": "safety",
  "board": "interface",
  "phase": "R1",
  "component_interface": "Watchdog, AMP_MUTE, AMP_FAULT and PGOOD safe state",
  "description": "The product requires physical mute during off/boot/fault and fault-injection timing, but does not define electrical defaults, fault propagation or allowed response time. Software alone is disallowed.",
  "evidence": [
    {
      "source": "docs/product/ANC_B2B_Custom_PCB_2_Kart_Mimari_Tasarim_Dokumani_v1.0.docx",
      "location": "§§3.1, 4.1, 6, 7.1; §9 watchdog/mute EOL row",
      "note": "Safe-state behavior is required; exact electrical/timing contract remains open."
    }
  ],
  "calculation_reference": [],
  "status": "open",
  "blocking": true,
  "discovered_at": "2026-09-26T10:41:41Z",
  "blocks_from_phase": "R4",
  "decision_id": null,
  "closure_criterion": "Before R4 PASS, approve the hardware default-safe, watchdog/fault/brownout mute dependency and target response-time contract from product/safety input; R2/R3 verify achievable levels and paths. Validate timing physically at EVT/EOL.",
  "resolved_by": null,
  "resolution": null
}
