{
  "id": "PV1-R1-003",
  "title": "Final secondary speaker requires real-crib A/B evidence",
  "severity": "blocking",
  "category": "validation",
  "board": "board_b",
  "phase": "R1",
  "component_interface": "CE70PR-4 / SLS-65 secondary speakers",
  "description": "The product names CE70PR-4 as a candidate and requires real-crib comparison with SLS-65 before serial BOM selection. A paper choice would not establish acoustic or electrical behavior.",
  "evidence": [
    {
      "source": "docs/product/ANC_B2B_Custom_PCB_2_Kart_Mimari_Tasarim_Dokumani_v1.0.docx",
      "location": "§1.1 speaker; §10 EVT-1; §12 item 3",
      "note": "Final speaker choice follows the prescribed physical A/B test."
    }
  ],
  "calculation_reference": [],
  "status": "open",
  "blocking": true,
  "discovered_at": "2026-09-26T10:41:41Z",
  "blocks_from_phase": "R13",
  "decision_id": "D3",
  "closure_criterion": "Record controlled A/B tests in the actual crib at 80/100/125/160/250/500/800 Hz, including attenuation, THD, excursion, Vrms/Irms and repeatable operating conditions; approve final speaker and load envelope before R13 PASS.",
  "resolved_by": null,
  "resolution": null
}
